{
  "$schema": "https://json-schema.org/draft/2020-12/schema",
  "$id": "https://devcareer-prep.local/schemas/gap-report.schema.json",
  "title": "DevCareer Prep Gap Report",
  "description": "L3 갭 리포트(gap-report.json). knowledge-map.json 노드 ID만 참조한다(단방향 6계층 참조). MVP는 자가진단 입력만 받고 퀴즈로 검증하지 않는다(오류 증폭 사슬 방지) — GapAnalyzer가 사용자 자가진단과 지식맵을 대조해 생성한다.",
  "type": "object",
  "additionalProperties": false,
  "required": [
    "schemaVersion", "generatedAt", "sourceRepoHead", "contentHash",
    "coverage", "truncated", "nodes"
  ],
  "properties": {
    "schemaVersion": { "$ref": "#/$defs/schemaVersion" },
    "generatedAt": { "type": "string", "format": "date-time" },
    "sourceRepoHead": {
      "type": "string",
      "pattern": "^[0-9a-f]{40}$",
      "description": "생성 시점 대상 레포 HEAD. AC-22 스테일 판정의 정본 값."
    },
    "contentHash": {
      "type": "string",
      "minLength": 1,
      "description": "이 파일 본문(generatedAt과 이 필드 자신은 제외)의 SHA-256 해시. 우발적 손상·부분 편집을 잡기 위한 필드이며, 키 없는 SHA-256이므로 의도적 위조는 막지 못한다(evidence.json에서만 scripts/verify-evidence.mjs·validate-plugin.mjs --schema-check가 scripts/lib/content-hash.mjs로 재계산·대조한다 — 이 L1+ 레이어는 그 결정적 생성기가 이 레포에 아직 구현되어 있지 않다)."
    },
    "coverage": { "$ref": "#/$defs/coverage" },
    "truncated": { "$ref": "#/$defs/truncated" },
    "nodes": {
      "type": "array",
      "minItems": 1,
      "description": "갭 노드 목록. 노드가 0개인 산출물은 AC-13이 금지한 '빈손 출력'이다 — minItems로 스키마 레벨에서 막는다. FactChecker가 전 항목을 반증했더라도 항목 단위 강등(verification.status=refuted)으로 남겨 출력하며, 아무것도 내보내지 않는 경로는 없다.",
      "items": { "$ref": "#/$defs/gapNode" }
    }
  },
  "$defs": {
    "schemaVersion": {
      "type": "string",
      "pattern": "^\\d+\\.\\d+\\.\\d+$",
      "default": "0.1.0"
    },
    "coverage": {
      "type": "object",
      "additionalProperties": false,
      "required": ["analyzed", "total", "traversed", "period", "exclusions", "samplingMethod"],
      "properties": {
        "analyzed": { "type": "integer", "minimum": 0 },
        "total": { "type": "integer", "minimum": 0 },
        "traversed": { "type": "integer", "minimum": 0 },
        "period": {
          "type": "object",
          "additionalProperties": false,
          "required": ["since", "until"],
          "properties": {
            "since": { "type": ["string", "null"], "format": "date" },
            "until": { "type": ["string", "null"], "format": "date" }
          }
        },
        "exclusions": {
          "type": "object",
          "additionalProperties": false,
          "required": ["bots", "vendoredPaths", "mergeIncluded", "selectedIdentities"],
          "properties": {
            "bots": { "type": "boolean" },
            "vendoredPaths": { "type": "boolean" },
            "mergeIncluded": { "type": "boolean" },
            "selectedIdentities": { "type": "array", "items": { "type": "string", "format": "email" } }
          }
        },
        "samplingMethod": { "type": "string", "x-verbatim": true, "minLength": 1 }
      }
    },
    "truncated": {
      "type": "object",
      "additionalProperties": false,
      "required": ["reason", "dropped_commits"],
      "properties": {
        "reason": { "type": "string", "enum": ["none", "budget_commits"] },
        "dropped_commits": { "type": "integer", "minimum": 0 }
      },
      "allOf": [
        { "if": { "properties": { "reason": { "const": "none" } } }, "then": { "properties": { "dropped_commits": { "const": 0 } } } },
        { "if": { "properties": { "reason": { "const": "budget_commits" } } }, "then": { "properties": { "dropped_commits": { "minimum": 1 } } } }
      ]
    },
    "evidenceCitation": {
      "type": "object",
      "additionalProperties": false,
      "required": ["ledgerId"],
      "properties": {
        "ledgerId": { "type": "string", "minLength": 1 },
        "path": { "type": "string" }
      }
    },
    "basis": {
      "type": "string",
      "enum": ["inference", "external", "insufficient"],
      "description": "갭 분석은 지식맵(commit basis 금지)에서 파생된 추론이므로 knowledge-map과 동일하게 commit basis를 쓸 수 없다."
    },
    "verification": {
      "type": "object",
      "additionalProperties": false,
      "required": ["status", "attempts", "reasonCode"],
      "description": "2단 팩트체크(LLM 반증 판정)의 결과. basis와 **직교하는 별도 축**이다 — basis는 '이 주장이 어떤 등급의 근거를 갖는가'이고 이 필드는 '그 근거가 반증 시도를 견뎠는가'이다. 따라서 강등이 basis를 바꾸지 않는다. AC-13의 '근거 부족 - 미검증' 배지는 이 필드에서만 파생하며, 렌더 마크다운이 배지를 자기 판단으로 붙이지 않는다(정본은 JSON이고 마크다운은 그 뷰라는 §1 결정이 여기 걸려 있다). plan.schema.json의 verificationStatus와 이름이 비슷하지만 다른 축이다 — 그쪽은 생성된 문제의 신뢰 등급이고 이쪽은 사실 주장의 반증 결과다. 두 필드를 통합하지 마라.",
      "properties": {
        "status": {
          "type": "string",
          "enum": ["verified", "refuted", "not-attempted"],
          "description": "verified=FactChecker가 반증하지 못했다. refuted=재생성 상한(2회)까지 반증당해 강등됐다. not-attempted=아직 판정 대상이 아니었다. 'refuted'와 'not-attempted'를 구분하지 않으면 '검증을 시도했고 반증당함'과 '애초에 근거가 없음'이 같은 값으로 뭉개져, 재실행 시 재시도 상한이 초기화된다."
        },
        "attempts": {
          "type": "integer",
          "minimum": 0,
          "maximum": 2,
          "description": "이 노드에 대해 수행한 재생성 시도 횟수. spec.md §3이 상한을 2회로 고정했으므로 2를 넘을 수 없다. 재실행 시 기존 산출물의 값을 이어받는다 — 매 실행 0으로 초기화하면 상한이 사실상 무한이 된다."
        },
        "reasonCode": {
          "type": ["string", "null"],
          "pattern": "^[A-Z][A-Z0-9_]*$",
          "description": "강등 사유의 기계 판독 코드(예: NO_SUPPORTING_DIFF). status가 refuted가 아니면 null이다. 자유 서술이 아니므로 AC-19 언어 린트 대상이 아니며(x-freeText를 붙이지 않는다), AC-8 오염 스위트의 기대 REJECT 사유 문자열 대조에 그대로 쓸 수 있다. 사람이 읽을 설명이 필요하면 노드 text에 한국어로 적는다."
        }
      }
    },
    "gapNode": {
      "type": "object",
      "additionalProperties": false,
      "required": ["id", "basis", "evidence", "verification", "parentRefs", "origin", "locked", "topic", "text", "selfAssessment"],
      "properties": {
        "id": {
          "type": "string",
          "minLength": 1,
          "pattern": "^[A-Za-z0-9:_-]+$",
          "description": "이 노드의 고유 ID. L4(plan) 노드가 parentRefs로 이 ID를 인용한다."
        },
        "basis": { "$ref": "#/$defs/basis" },
        "evidence": {
          "type": "array",
          "items": { "$ref": "#/$defs/evidenceCitation" },
          "description": "AC-12: 빈 배열이면 basis는 insufficient여야 한다."
        },
        "parentRefs": {
          "type": "array",
          "minItems": 1,
          "items": { "type": "string", "minLength": 1 },
          "description": "knowledge-map.json nodes[].id 참조 목록. AC-14 계층 ID 참조 무결성 검사 대상. 상위(plan)로의 역참조는 금지."
        },
        "verification": { "$ref": "#/$defs/verification" },
        "origin": {
          "type": "string",
          "enum": ["generated", "user"],
          "description": "이 노드가 LLM 생성분인지 사용자 수동 추가분인지. **이 값은 병합·편집 감지 로직(구현 7단계)만 설정하며 생성 템플릿이 직접 기입하지 않는다** — AC-19 언어 린트의 origin:user 제외가 자기면제 통로가 되지 않게 하기 위해서다."
        },
        "locked": { "type": "boolean" },
        "topic": {
          "type": "string",
          "x-termField": true,
          "minLength": 1,
          "description": "갭이 식별된 지식 주제명(기술 용어·고유명사 — 언어 린트 제외)."
        },
        "text": {
          "type": "string",
          "x-freeText": true,
          "description": "이 갭에 대한 서술(한국어로)."
        },
        "selfAssessment": {
          "type": "string",
          "x-freeText": true,
          "description": "사용자가 입력한 자가진단 원문 요약(한국어로). 퀴즈로 재검증하지 않는다(MVP 범위)."
        },
        "externalUrl": {
          "type": "string",
          "format": "uri",
          "description": "basis:\"external\"일 때 필수. references/sources.json allow-list 내 URL이어야 한다(allow-list 대조는 scripts/verify-evidence.mjs의 (f)축 checkExternalSources가 런타임에 검사하며 이 스키마는 형식만 검사한다). 그 검사는 allow-list 소속 여부만 확인하며 URL이 실제로 존재하는지·그 서술을 뒷받침하는지는 확인하지 않는다 — 후자는 2단 팩트체크(verification)의 몫이다(구현 8단계 (d))."
        }
      },
      "allOf": [
        {
          "if": { "properties": { "basis": { "const": "external" } } },
          "then": { "required": ["externalUrl"] }
        },
        {
          "if": { "properties": { "evidence": { "maxItems": 0 } } },
          "then": { "properties": { "basis": { "enum": ["insufficient", "external"] } } }
        },
        {
          "if": { "properties": { "verification": { "properties": { "status": { "const": "not-attempted" } } } } },
          "then": { "properties": { "verification": { "properties": { "attempts": { "const": 0 }, "reasonCode": { "type": "null" } } } } }
        },
        {
          "if": { "properties": { "verification": { "properties": { "status": { "const": "refuted" } } } } },
          "then": { "properties": { "verification": { "properties": { "attempts": { "const": 2 }, "reasonCode": { "type": "string", "minLength": 1 } } } } }
        },
        {
          "if": { "properties": { "verification": { "properties": { "status": { "const": "verified" } } } } },
          "then": { "properties": { "verification": { "properties": { "reasonCode": { "type": "null" } } } } }
        }
      ]
    }
  }
}
