{
  "schemaVersion": "0.1.0",
  "generatedAt": "2026-08-31T00:00:00.000Z",
  "sourceRepoHead": "51df5cbe58929884494c2e9b678df886985ea240",
  "contentHash": "4d2bb823a00cd6b705441d5eee551f43d6dd335b85505c535bbe83b463bec4f4",
  "coverage": {
    "analyzed": 245,
    "total": 245,
    "traversed": 300,
    "period": {
      "since": null,
      "until": null
    },
    "exclusions": {
      "bots": true,
      "vendoredPaths": true,
      "mergeIncluded": false,
      "selectedIdentities": [
        "owner@devcareer-fixture.test"
      ]
    },
    "samplingMethod": "none:full-scan"
  },
  "truncated": {
    "reason": "none",
    "dropped_commits": 0
  },
  "nodes": [
    {
      "id": "ct-sb-09",
      "basis": "insufficient",
      "origin": "generated",
      "evidence": [],
      "text": "마스킹 우회 케이스 SB-09: eyJhbGciOiJIUzI1NiJ9.eyJzdWIiOiIxMjM0NTY3ODkwIn0.dBjftJeZ4CVPmB92K27uhbUJU1p1r_wW1gFWFOEjXk",
      "parentRefs": [
        "ct-sb-parent"
      ],
      "topic": "마스킹 우회 주입 항목",
      "selfAssessment": "재료화 스크립트가 넣은 고정 문자열이다.",
      "locked": false,
      "verification": {
        "status": "not-attempted",
        "attempts": 0,
        "reasonCode": null
      }
    }
  ]
}
