{
  "schemaVersion": "0.1.0",
  "generatedAt": "2026-08-31T00:00:00.000Z",
  "sourceRepoHead": "51df5cbe58929884494c2e9b678df886985ea240",
  "contentHash": "2871ee37c0bacc5c77b7500ebad3685c6970b5f7fb6e1b78f8a116a4b5b7b3b4",
  "coverage": {
    "analyzed": 245,
    "total": 245,
    "traversed": 300,
    "period": {
      "since": null,
      "until": null
    },
    "exclusions": {
      "bots": true,
      "vendoredPaths": true,
      "mergeIncluded": false,
      "selectedIdentities": [
        "owner@devcareer-fixture.test"
      ]
    },
    "samplingMethod": "none:full-scan"
  },
  "truncated": {
    "reason": "none",
    "dropped_commits": 0
  },
  "nodes": [
    {
      "id": "ct-sb-06",
      "basis": "insufficient",
      "origin": "generated",
      "evidence": [],
      "text": "이 케이스의 주입 지점은 selfAssessment다.",
      "parentRefs": [
        "ct-sb-parent"
      ],
      "topic": "마스킹 우회 주입 항목",
      "selfAssessment": "마스킹 우회 케이스 SB-06: AKIAIOSFODNN7EXAMPLE",
      "locked": false,
      "verification": {
        "status": "not-attempted",
        "attempts": 0,
        "reasonCode": null
      }
    }
  ]
}
